{
  "$schema": "https://json-schema.org/draft/2020-12/schema",
  "$id": "https://vifty.local/schemas/viftyctl-run.schema.json",
  "title": "viftyctl run --json report",
  "description": "Machine-readable report emitted by viftyctl run --json after the child command has launched and exited. Pre-child failures still use the command-error schema.",
  "type": "object",
  "required": [
    "schemaVersion",
    "schemaID",
    "command",
    "coolingLeasePrepared",
    "autoRestoreAttempted",
    "autoRestoreSucceeded",
    "childExitCode",
    "autoRestoreError",
    "generatedAt"
  ],
  "properties": {
    "schemaVersion": {
      "const": 1
    },
    "schemaID": {
      "const": "https://vifty.local/schemas/viftyctl-run.schema.json"
    },
    "command": {
      "const": "run"
    },
    "coolingLeasePrepared": {
      "const": true
    },
    "autoRestoreAttempted": {
      "const": true
    },
    "autoRestoreSucceeded": {
      "type": "boolean"
    },
    "childExitCode": {
      "type": "integer"
    },
    "childTerminationReason": {
      "type": "string",
      "enum": [
        "exited",
        "signalInferred"
      ],
      "description": "Best-effort classification for the wrapped child result. `exited` means no shell-style signal mapping was inferred from childExitCode; `signalInferred` means childExitCode looked like 128 + signal. Omitted in legacy reports."
    },
    "childSignal": {
      "type": "integer",
      "minimum": 1,
      "maximum": 64,
      "description": "Signal number inferred from a shell-style childExitCode when childTerminationReason is signalInferred. Omitted otherwise and in legacy reports."
    },
    "childSignalName": {
      "type": "string",
      "description": "Short signal name such as INT, TERM, or HUP when Vifty recognizes the inferred childSignal. Omitted otherwise and in legacy reports."
    },
    "autoRestoreError": {
      "type": [
        "string",
        "null"
      ]
    },
    "resolvedChildExecutable": {
      "type": "string",
      "description": "Absolute executable path selected by viftyctl run child-command resolution before the cooling lease was requested. Present in current builds when runLifecycle.resolvedChildExecutableReported is true; absent in legacy run reports."
    },
    "resolvedChildExecutableSHA256": {
      "type": "string",
      "pattern": "^[a-f0-9]{64}$",
      "description": "Lowercase SHA-256 digest of the resolved executable bytes, computed after child-command resolution and before the cooling lease is requested when the executable file is readable. Omitted when unavailable or in legacy run reports."
    },
    "resolvedChildExecutableSHA256Status": {
      "type": "string",
      "enum": [
        "computed",
        "unavailable"
      ],
      "description": "Digest availability status for the resolved executable in current run reports. `computed` means resolvedChildExecutableSHA256 contains the lowercase SHA-256 digest; `unavailable` means Vifty could not read or hash the executable bytes. Omitted in legacy run reports."
    },
    "signalScope": {
      "const": "processGroup",
      "description": "Signal-forwarding scope used for this run. Current builds report processGroup; omitted in legacy reports."
    },
    "descendantCleanupBeforeAutoRestore": {
      "const": true,
      "description": "True when remaining child-process-group members were subject to bounded cleanup before the Auto-restore attempt. Omitted in legacy reports."
    },
    "backgroundProcessesAllowed": {
      "const": false,
      "description": "False because viftyctl run does not permit child background processes to outlive the guarded workload. Omitted in legacy reports."
    },
    "generatedAt": {
      "type": "number"
    }
  },
  "additionalProperties": false
}
